{
  "paper": {
    "arxiv_id": "2607.01232",
    "title": "Is One Layer Enough? Training A Single Transformer Layer Can Match Full-Parameter RL Training",
    "summary": "Reinforcement learning (RL) has become a central component of post-training large language models (LLMs), yet little is understood about how RL adaptation is distributed across transformer layers. Existing approaches typically update all model parameters uniformly, implicitly assuming that every layer contributes similarly to the gains obtained during RL post-training. The authors challenge this assumption through a systematic layer-wise study of RL training and find that training a single transformer layer can recover most of the gains achieved by full-parameter RL training, and in some cases even surpass it. To quantify this phenomenon they introduce the 'layer contribution' metric, C(k). Across seven models spanning two model families (Qwen3, Qwen2.5), three RL algorithms (GRPO, GiGPO, Dr. GRPO), and multiple task domains, RL gains are highly concentrated in a small subset of, and in many cases even a single, transformer layer -- typically located in the middle of the stack.",
    "source_url": "https://arxiv.org/abs/2607.01232"
  },
  "equation": {
    "id": "layer-contribution",
    "name": "Eq. (4) — Layer contribution C(k)",
    "equation_latex": "\\mathcal{C}(k)=\\frac{S_{k}-S_{\\text{base}}}{S_{\\text{full}}-S_{\\text{base}}}",
    "source": {
      "location": "Sec. 3, Eq. (4)",
      "raw_context": "This procedure is repeated independently for every layer k in {0,...,L-1}, isolating each layer's ability to absorb RL-induced improvement. Each resulting model is then evaluated on the same set of in-domain benchmarks to obtain a performance score. To quantify each layer's capacity to capture RL-induced improvement, we define layer contribution. Let S_k denote the in-domain performance of the model trained on layer k, measured as the average score across in-domain benchmarks. Let S_base denote the performance of the original pretrained model without any RL training, and S_full denote the performance of the model after standard full-parameter GRPO training. The layer contribution of layer k is: C(k) = (S_k - S_base) / (S_full - S_base). A layer contribution of 1.0 indicates that single-layer training fully matches the gain of full-parameter training; values above 1.0 indicate that it surpasses full-parameter training; values near 0 indicate that the layer fails to capture meaningful RL improvements."
    }
  },
  "symbol_map": [
    {
      "symbol": "\\mathcal{C}(k)",
      "meaning": "The layer contribution of layer k: the fraction of full-parameter RL's improvement that is recovered by training only layer k in isolation (all other parameters frozen).",
      "role": "output",
      "grounding_sentence": "To quantify each layer's capacity to capture RL-induced improvement, we define layer contribution... The layer contribution of layer k is: C(k) = (S_k - S_base) / (S_full - S_base)."
    },
    {
      "symbol": "k",
      "meaning": "Index of a single transformer layer, ranging over all L layers of the model (k in {0, ..., L-1}); this is the layer that was selectively unfrozen and trained with GRPO while all other parameters stayed fixed.",
      "role": "index",
      "grounding_sentence": "This procedure is repeated independently for every layer k in {0,...,L-1}, isolating each layer's ability to absorb RL-induced improvement."
    },
    {
      "symbol": "S_{k}",
      "meaning": "In-domain benchmark performance (average score) of the model after training only layer k with RL, all other layers frozen.",
      "role": "input",
      "grounding_sentence": "Let S_k denote the in-domain performance of the model trained on layer k, measured as the average score across in-domain benchmarks."
    },
    {
      "symbol": "S_{\\text{base}}",
      "meaning": "Baseline performance of the original pretrained model before any RL training is applied.",
      "role": "input",
      "grounding_sentence": "Let S_base denote the performance of the original pretrained model without any RL training."
    },
    {
      "symbol": "S_{\\text{full}}",
      "meaning": "Performance of the model after standard full-parameter GRPO training (every layer updated), the gold-standard upper reference the single layer is compared against.",
      "role": "input",
      "grounding_sentence": "S_full denote the performance of the model after standard full-parameter GRPO training."
    }
  ],
  "color_spans": [
    {
      "id": "ck",
      "latex_fragment": "\\mathcal{C}(k)",
      "color": "#7c3aed",
      "label": "Layer contribution",
      "explanation": "The score this equation defines: how much of the full RL improvement one isolated layer k can capture on its own, expressed as a fraction/ratio."
    },
    {
      "id": "numerator",
      "latex_fragment": "S_{k}-S_{\\text{base}}",
      "color": "#0891b2",
      "label": "Single-layer gain (numerator)",
      "explanation": "The improvement that training only layer k buys you: its benchmark score S_k minus the untrained baseline score S_base. This isolates the RL-induced gain from training just one layer."
    },
    {
      "id": "denominator",
      "latex_fragment": "S_{\\text{full}}-S_{\\text{base}}",
      "color": "#059669",
      "label": "Full-parameter RL gain (denominator)",
      "explanation": "The total improvement achieved when every layer in the model is updated by standard full-parameter RL -- the normalizing reference. Dividing by this turns the single-layer gain into a fraction of the best-case full-model gain."
    }
  ],
  "plain_english_explanation": "This equation defines a single number, C(k), that tells you what percentage of the total benefit of RL fine-tuning you get if you only unfreeze and train one transformer layer, layer k, instead of the whole model. The numerator, S_k minus S_base, is the raw improvement that single-layer training buys you over the untrained baseline. The denominator, S_full minus S_base, is the raw improvement that ordinary full-parameter RL training buys you over that same baseline. Dividing the two normalizes single-layer training against the best case (updating everything), so C(k) = 1.0 means training just layer k recovers all of full-parameter RL's benefit, values above 1.0 mean it does even better, and values near 0 mean that layer barely helps at all.",
  "intuitive_analogy": "Imagine a car's overall speedup after a full engine tune-up (S_full versus its stock performance S_base). Now imagine only replacing one component -- say, just the spark plugs -- and measuring the speedup that gives (S_k versus S_base). Layer contribution C(k) is the ratio of the single-part upgrade's speedup to the full tune-up's speedup: if replacing just the spark plugs gets you 90% of the full tune-up's benefit, that part had a layer contribution of 0.9, telling you it was doing most of the real work all along.",
  "callout_boxes": [
    {
      "anchor_span": "ck",
      "text": "This is the paper's headline quantity: it operationalizes 'how much does this one layer matter for RL gains' as a single normalized ratio, enabling direct comparison across 7 models, 3 RL algorithms, and multiple tasks."
    },
    {
      "anchor_span": "numerator",
      "text": "S_k comes from repeating the single-layer training procedure (Eq. 3 in the paper) independently for every layer k, then evaluating that resulting model on in-domain benchmarks. Subtracting S_base isolates the marginal RL-induced gain rather than raw model quality."
    },
    {
      "anchor_span": "denominator",
      "text": "This denominator is fixed per model/task/algorithm -- it's computed once from standard full-parameter GRPO training and then reused to normalize every layer's C(k)."
    }
  ],
  "source_quotes": [
    {
      "quote": "To quantify each layer's capacity to capture RL-induced improvement, we define layer contribution.",
      "location": "Sec. 3",
      "supports": [
        "ck"
      ]
    },
    {
      "quote": "Let S_k denote the in-domain performance of the model trained on layer k, measured as the average score across in-domain benchmarks.",
      "location": "Sec. 3",
      "supports": [
        "numerator"
      ]
    },
    {
      "quote": "Let S_base denote the performance of the original pretrained model without any RL training, and S_full denote the performance of the model after standard full-parameter GRPO training.",
      "location": "Sec. 3",
      "supports": [
        "numerator",
        "denominator"
      ]
    },
    {
      "quote": "A layer contribution of 1.0 indicates that single-layer training fully matches the gain of full-parameter training; values above 1.0 indicate that it surpasses full-parameter training; values near 0 indicate that the layer fails to capture meaningful RL improvements.",
      "location": "Sec. 3, following Eq. (4)",
      "supports": [
        "ck",
        "denominator"
      ]
    },
    {
      "quote": "Surprisingly, we find that training a single transformer layer can recover most of the gains achieved by full-parameter RL training, and in some cases even surpass it.",
      "location": "Abstract",
      "supports": [
        "ck"
      ]
    }
  ],
  "confidence": {
    "score": 0.93,
    "notes": "All symbols and the equation itself were read verbatim from the arXiv HTML (LaTeXML alttext), which is the authoritative equation source. The surrounding prose gives explicit, unambiguous definitions for every symbol (S_k, S_base, S_full, k, C(k)) directly adjacent to the equation, so grounding is strong and not inferential. The only minor softness: 'in-domain benchmarks' and the exact benchmark list are described a few paragraphs later in the paper rather than inline with the equation; confidence would reach ~1.0 by also quoting that benchmark list verbatim."
  }
}